{
  "$schema": "https://json-schema.org/draft/2020-12/schema",
  "title": "R2 M9 one-candidate explicit sponsor design acceptance",
  "type": "object",
  "additionalProperties": false,
  "required": [
    "schema_version",
    "status",
    "acceptance_mode",
    "acceptance_scope",
    "accepted_candidate_head",
    "accepted_candidate_parent",
    "accepted_adr_sha256",
    "review_contract_sha256",
    "sponsor_decision",
    "amendment",
    "artifacts",
    "independent_review_status",
    "independent_reviews",
    "limitations",
    "production_operations_authorized",
    "acceptance_changed_paths"
  ],
  "properties": {
    "schema_version": {
      "const": "1"
    },
    "status": {
      "const": "M9_DESIGN_ACCEPTED"
    },
    "acceptance_mode": {
      "const": "EXPLICIT_SPONSOR_DECISION"
    },
    "acceptance_scope": {
      "const": "M9_DESIGN_ONLY"
    },
    "accepted_candidate_head": {
      "const": "24fa05e0610efa6fb60db50d1b22b10de48f2786"
    },
    "accepted_candidate_parent": {
      "type": "string",
      "pattern": "^[0-9a-f]{40}$"
    },
    "accepted_adr_sha256": {
      "type": "string",
      "pattern": "^[0-9a-f]{64}$"
    },
    "review_contract_sha256": {
      "type": "string",
      "pattern": "^[0-9a-f]{64}$"
    },
    "sponsor_decision": {
      "type": "object",
      "additionalProperties": false,
      "required": [
        "authority",
        "quote",
        "recorded_at"
      ],
      "properties": {
        "authority": {
          "const": "SPONSOR_USER_INSTRUCTION"
        },
        "quote": {
          "const": "chap nhan m9 roi sang buoc tiep theo luon"
        },
        "recorded_at": {
          "type": "string",
          "format": "date-time"
        }
      }
    },
    "amendment": {
      "type": "object",
      "additionalProperties": false,
      "required": [
        "path",
        "sha256"
      ],
      "properties": {
        "path": {
          "const": "docs/adr/0110-m9-design-acceptance-by-explicit-sponsor-decision.md"
        },
        "sha256": {
          "type": "string",
          "pattern": "^[0-9a-f]{64}$"
        }
      }
    },
    "artifacts": {
      "type": "object",
      "additionalProperties": false,
      "required": [
        "docs/adr/0081-m9-evidence-first-opportunity-intelligence.md",
        "docs/research/2026-09-14-r2-m9-opportunity-research-intelligence.md",
        "docs/research/2026-09-15-r2-m9-design-validation.md",
        "docs/superpowers/specs/2026-09-14-r2-m9-opportunity-research-intelligence-design.md",
        "docs/superpowers/plans/2026-09-14-r2-m9-opportunity-research-intelligence.md",
        "docs/superpowers/plans/2026-09-14-r2-m9a-foundation-cohort-profiles.md",
        "docs/r2/evidence/R2_M9_EXECUTION_CONTRACT_2026-09-14.json",
        "docs/r2/evidence/R2_M9_DESIGN_ACCEPTANCE_CONTRACT_2026-09-15.json",
        "docs/r2/evidence/schemas/R2_M9_DESIGN_ACCEPTANCE.schema.json",
        "docs/r2/evidence/schemas/R2_M9_DESIGN_REVIEW.schema.json",
        "scripts/r2/verify_m9_design_acceptance.py",
        "tests/unit/scripts/r2/test_verify_m9_design_acceptance.py"
      ],
      "properties": {
        "docs/adr/0081-m9-evidence-first-opportunity-intelligence.md": {
          "type": "string",
          "pattern": "^[0-9a-f]{64}$"
        },
        "docs/research/2026-09-14-r2-m9-opportunity-research-intelligence.md": {
          "type": "string",
          "pattern": "^[0-9a-f]{64}$"
        },
        "docs/research/2026-09-15-r2-m9-design-validation.md": {
          "type": "string",
          "pattern": "^[0-9a-f]{64}$"
        },
        "docs/superpowers/specs/2026-09-14-r2-m9-opportunity-research-intelligence-design.md": {
          "type": "string",
          "pattern": "^[0-9a-f]{64}$"
        },
        "docs/superpowers/plans/2026-09-14-r2-m9-opportunity-research-intelligence.md": {
          "type": "string",
          "pattern": "^[0-9a-f]{64}$"
        },
        "docs/superpowers/plans/2026-09-14-r2-m9a-foundation-cohort-profiles.md": {
          "type": "string",
          "pattern": "^[0-9a-f]{64}$"
        },
        "docs/r2/evidence/R2_M9_EXECUTION_CONTRACT_2026-09-14.json": {
          "type": "string",
          "pattern": "^[0-9a-f]{64}$"
        },
        "docs/r2/evidence/R2_M9_DESIGN_ACCEPTANCE_CONTRACT_2026-09-15.json": {
          "type": "string",
          "pattern": "^[0-9a-f]{64}$"
        },
        "docs/r2/evidence/schemas/R2_M9_DESIGN_ACCEPTANCE.schema.json": {
          "type": "string",
          "pattern": "^[0-9a-f]{64}$"
        },
        "docs/r2/evidence/schemas/R2_M9_DESIGN_REVIEW.schema.json": {
          "type": "string",
          "pattern": "^[0-9a-f]{64}$"
        },
        "scripts/r2/verify_m9_design_acceptance.py": {
          "type": "string",
          "pattern": "^[0-9a-f]{64}$"
        },
        "tests/unit/scripts/r2/test_verify_m9_design_acceptance.py": {
          "type": "string",
          "pattern": "^[0-9a-f]{64}$"
        }
      }
    },
    "independent_review_status": {
      "const": "WAIVED_FOR_THIS_CANDIDATE_BY_SPONSOR"
    },
    "independent_reviews": {
      "type": "array",
      "maxItems": 0
    },
    "limitations": {
      "type": "array",
      "minItems": 2,
      "items": {
        "type": "string",
        "minLength": 1
      }
    },
    "production_operations_authorized": {
      "const": false
    },
    "acceptance_changed_paths": {
      "const": [
        "docs/adr/0081-m9-evidence-first-opportunity-intelligence.md",
        "docs/adr/0110-m9-design-acceptance-by-explicit-sponsor-decision.md",
        "docs/r2/evidence/R2_M9_DESIGN_ACCEPTANCE.json",
        "docs/r2/evidence/R2_M9_DESIGN_REVIEW_HANDOFF_2026-10-15.md",
        "docs/r2/evidence/schemas/R2_M9_SPONSOR_DESIGN_ACCEPTANCE.schema.json"
      ]
    }
  }
}
